{
  "edges": [
    {
      "id": "event-home-enter-debug_print-1-1",
      "kind": "exec",
      "source": "event-home-enter",
      "source_handle": "exec_out",
      "target": "debug_print-1",
      "target_handle": "exec_in"
    },
    {
      "id": "event-detail-enter-debug_print-2-1",
      "kind": "exec",
      "source": "event-detail-enter",
      "source_handle": "exec_out",
      "target": "debug_print-2",
      "target_handle": "exec_in"
    }
  ],
  "id": "macro-mukjsthq",
  "metadata": {
    "editor_screen_node_ids": {
      "reservation_detail": [
        "debug_print-2"
      ],
      "reservation_home": [
        "debug_print-1"
      ]
    }
  },
  "name": "새 매크로",
  "nodes": [
    {
      "config": {
        "event": "enter",
        "screen_id": "reservation_home"
      },
      "id": "event-home-enter",
      "label": "스터디룸 예약 메인 / Enter",
      "position": {
        "x": 4.501754807931775,
        "y": -114.06967924819284
      },
      "type": "screen_enter"
    },
    {
      "config": {
        "event": "update",
        "interval_ms": 1000,
        "screen_id": "reservation_home",
        "skip_if_running": true
      },
      "id": "event-home-update",
      "label": "스터디룸 예약 메인 / Update",
      "position": {
        "x": 363.4118830947867,
        "y": -123.294441073927
      },
      "type": "screen_update"
    },
    {
      "config": {
        "event": "exit",
        "screen_id": "reservation_home"
      },
      "id": "event-home-exit",
      "label": "스터디룸 예약 메인 / Exit",
      "position": {
        "x": 600.0,
        "y": 60.0
      },
      "type": "screen_exit"
    },
    {
      "config": {
        "event": "enter",
        "screen_id": "reservation_detail"
      },
      "id": "event-detail-enter",
      "label": "스터디룸 예약 상세 / Enter",
      "position": {
        "x": 80.0,
        "y": 60.0
      },
      "type": "screen_enter"
    },
    {
      "config": {
        "event": "update",
        "interval_ms": 1000,
        "screen_id": "reservation_detail",
        "skip_if_running": true
      },
      "id": "event-detail-update",
      "label": "스터디룸 예약 상세 / Update",
      "position": {
        "x": 340.0,
        "y": 60.0
      },
      "type": "screen_update"
    },
    {
      "config": {
        "event": "exit",
        "screen_id": "reservation_detail"
      },
      "id": "event-detail-exit",
      "label": "스터디룸 예약 상세 / Exit",
      "position": {
        "x": 600.0,
        "y": 60.0
      },
      "type": "screen_exit"
    },
    {
      "config": {
        "level": "info",
        "message": "메인 화면 입장"
      },
      "id": "debug_print-1",
      "position": {
        "x": 201.9861136024117,
        "y": 220.0134588561478
      },
      "type": "debug_print"
    },
    {
      "config": {
        "level": "info",
        "message": "예약 상세 들어오기"
      },
      "id": "debug_print-2",
      "position": {
        "x": 321.4736859367604,
        "y": 289.8163388977851
      },
      "type": "debug_print"
    }
  ],
  "screen_event_entry_node_ids": {
    "reservation_detail": {
      "enter": "event-detail-enter",
      "exit": "event-detail-exit",
      "update": "event-detail-update"
    },
    "reservation_home": {
      "enter": "event-home-enter",
      "exit": "event-home-exit",
      "update": "event-home-update"
    }
  },
  "version": 4
}
